{
  "$schema": "./repositories.schema.json",
  "$comment": "SPDX-FileCopyrightText: 2026 maninblack; SPDX-License-Identifier: MIT",
  "schemaVersion": 1,
  "workspace": {
    "solutionDirectory": "aosedge-sdv-demo",
    "acceptedBranches": ["main"],
    "obsoleteDirectoryNames": []
  },
  "repositories": [
    {
      "id": "carla",
      "directory": "CarlaSim",
      "role": "Virtual physical vehicle and CARLA simulator source",
      "visibility": "public",
      "repository": "https://github.com/alexmaninblack/carla.git",
      "remote": "personal",
      "acceptedRevision": "eb09b82464076596ee47e42b3f5f9b48f9ff5b30",
      "acceptedBranches": ["macos-apple-silicon"],
      "allowedDirtyPaths": []
    },
    {
      "id": "unreal-engine",
      "directory": "UnrealEngine5_carla",
      "role": "Restricted Unreal Engine build dependency for standalone CARLA",
      "visibility": "private",
      "repository": "https://github.com/alexmaninblack/UnrealEngine.git",
      "remote": "personal",
      "acceptedRevision": "9b705d6d2db5b769ab34edb04f3ca2bb8b960014",
      "acceptedBranches": ["macos-xcode26-compat"],
      "allowedDirtyPaths": ["Engine/Config/DefaultEngine.ini"]
    },
    {
      "id": "vehicle-gateway",
      "directory": "carla-ego-runtime",
      "role": "Simulated Vehicle Gateway ECU, control plane, VSS projection, and VISS server",
      "visibility": "public",
      "repository": "https://github.com/alexmaninblack/carla-ego-runtime.git",
      "remote": "origin",
      "acceptedRevision": "2e3d1164d491dac25e212f59315057deca0bf3d8",
      "acceptedBranches": ["main"],
      "allowedDirtyPaths": []
    },
    {
      "id": "vehicle-platform",
      "directory": "aos-vehicle-platform",
      "role": "Domain Controller vehicle integration and OEM platform/FOTA lifecycle",
      "visibility": "public",
      "repository": "https://github.com/alexmaninblack/aos-vehicle-platform.git",
      "remote": "origin",
      "acceptedRevision": "92a2138813983cb1c029fd3e61bd90b68241af63",
      "acceptedBranches": ["main"],
      "allowedDirtyPaths": []
    },
    {
      "id": "functional-service",
      "directory": "brake-health-service",
      "role": "In-vehicle Brake Health functional service with an independent SOTA lifecycle",
      "visibility": "public",
      "repository": "https://github.com/alexmaninblack/brake-health-service.git",
      "remote": "origin",
      "acceptedRevision": "5aa652fda603e7621043961331e58236b19204e9",
      "acceptedBranches": ["main"],
      "allowedDirtyPaths": []
    },
    {
      "id": "brake-health-cloud",
      "directory": "brake-health-cloud",
      "role": "Function Team 1 Brake Health backend and Function Dashboard",
      "visibility": "public",
      "repository": "https://github.com/alexmaninblack/brake-health-cloud.git",
      "remote": "origin",
      "acceptedRevision": "7c64adf7b3d99535ecc7c8cbe468bc527cbcdc12",
      "acceptedBranches": ["main"],
      "allowedDirtyPaths": []
    },
    {
      "id": "tire-health-service",
      "directory": "tire-health-service",
      "role": "Independent in-vehicle Tire Health service and advisory producer",
      "visibility": "public",
      "repository": "https://github.com/alexmaninblack/tire-health-service.git",
      "remote": "origin",
      "acceptedRevision": "f0a0f6edadb51aa338775d157aa3bde28f5b76f4",
      "acceptedBranches": ["main"],
      "allowedDirtyPaths": []
    },
    {
      "id": "tire-health-cloud",
      "directory": "tire-health-cloud",
      "role": "Function Team 2 Tire Health backend and observations",
      "visibility": "public",
      "repository": "https://github.com/alexmaninblack/tire-health-cloud.git",
      "remote": "origin",
      "acceptedRevision": "ea2d6deec9b704cb866d362eaefc9d87356ddeb5",
      "acceptedBranches": ["main"],
      "allowedDirtyPaths": []
    }
  ],
  "launcherPaths": [],
  "launchers": []
}
